{
  "schema_version": "1.0.0",
  "document_type": "review-audit-event",
  "document_id": "fixture-audit_001",
  "created_at": "2026-01-01T00:00:00Z",
  "workspace": "workspace_demo",
  "source_id": "src_synthetic_01",
  "source_hash": {
    "algorithm": "sha256",
    "value": "1111111111111111111111111111111111111111111111111111111111111111"
  },
  "review_generation": 1,
  "producer": {
    "kind": "ENGINE",
    "name": "s9k-data-engine",
    "version": "0.0.0-test",
    "model": null
  },
  "provenance": {
    "source_id": "src_synthetic_01",
    "source_hash": {
      "algorithm": "sha256",
      "value": "1111111111111111111111111111111111111111111111111111111111111111"
    },
    "review_generation": 1,
    "pipeline_version": "0.0.0-test",
    "producer": {
      "kind": "ENGINE",
      "name": "s9k-data-engine",
      "version": "0.0.0-test",
      "model": null
    }
  },
  "event_id": "evt_synth_001",
  "event_type": "DECISION_RECORDED",
  "actor_type": "HUMAN",
  "actor_id": "operador_demo",
  "timestamp": "2026-01-01T00:05:01Z",
  "candidate_id": "cand_synth_001",
  "plan_id": null,
  "request_id": "req_synth_001",
  "before_hash": {
    "algorithm": "sha256",
    "value": "1111111111111111111111111111111111111111111111111111111111111111"
  },
  "after_hash": {
    "algorithm": "sha256",
    "value": "2222222222222222222222222222222222222222222222222222222222222222"
  },
  "metadata": {
    "ui": "reviews"
  }
}
